18:00:37.899150 IP 192.168.100.48.53770 > 192.168.100.133.20371: Flags [.], ack 1, win 502, options [nop,nop,TS val 607508114 ecr 101062179], length 0
E..4N.@.@.....d0..d..
O..iT%.s&.....J-.....
$5.....#
18:00:42.898627 IP 192.168.100.133.20371 > 192.168.100.48.53770: Flags [.], ack 1, win 1448, options [nop,nop,TS val 101495459 ecr 607508114], length 0
E..43>@.@.....d...d0O..
.s&..iT%.....?.....
....$5..
18:00:42.898684 IP 192.168.100.48.53770 > 192.168.100.133.20371: Flags [.], ack 1, win 502, options [nop,nop,TS val 607513113 ecr 101062179], length 0
E..4N.@.@.....d0..d..
O..iT%.s&.....J-.....
$5.....#
18:00:47.898308 IP 192.168.100.133.20371 > 192.168.100.48.53770: Flags [.], ack 1, win 1448, options [nop,nop,TS val 101496099 ecr 607513113], length 0
E..43?@.@..~..d...d0O..
.s&..iT%.....7.....
...#$5..
18:00:47.898356 IP 192.168.100.48.53770 > 192.168.100.133.20371: Flags [.], ack 1, win 502, options [nop,nop,TS val 607518113 ecr 101062179], length 0
E..4N.@.@.....d0..d..
O..iT%.s&.....J-.....
$5.....#
18:00:52.897806 IP 192.168.100.133.20371 > 192.168.100.48.53770: Flags [.], ack 1, win 1448, options [nop,nop,TS val 101496739 ecr 607518113], length 0
E..43@@.@..}..d...d0O..
.s&..iT%...../.....
....$5..
18:00:52.897873 IP 192.168.100.48.53770 > 192.168.100.133.20371: Flags [.], ack 1, win 502, options [nop,nop,TS val 607523112 ecr 101062179], length 0
E..4N.@.@.....d0..d..
O..iT%.s&.....J-.....
$6.(...#
18:00:57.897383 IP 192.168.100.133.20371 > 192.168.100.48.53770: Flags [.], ack 1, win 1448, options [nop,nop,TS val 101497379 ecr 607523112], length 0
E..43A@.@..|..d...d0O..
.s&..iT%.....(.....
...#$6.(
18:00:57.897430 IP 192.168.100.48.53770 > 192.168.100.133.20371: Flags [.], ack 1, win 502, options [nop,nop,TS val 607528112 ecr 101062179], length 0
E..4N.@.@.....d0..d..
O..iT%.s&.....J-.....
$6$....#
18:00:58.131687 IP 192.168.100.133.20371 > 192.168.100.48.53770: Flags [P.], seq 1:41, ack 1, win 1448, options [nop,nop,TS val 101497409 ecr 607528112], length 40
E..\3B@.@..S..d...d0O..
.s&..iT%...........
...A$6$.HHAR2502301#Ba#131945#01321#S0000750#N01
18:00:58.131730 IP 192.168.100.48.53770 > 192.168.100.133.20371: Flags [.], ack 41, win 502, options [nop,nop,TS val 607528346 ecr 101497409], length 0
E..4N.@.@.....d0..d..
O..iT%.s&.....J-.....
$6%....A
18:00:58.132488 IP 192.168.100.48.53770 > 192.168.100.133.20371: Flags [F.], seq 1, ack 41, win 502, options [nop,nop,TS val 607528347 ecr 101497409], length 0
E..4N.@.@.....d0..d..
O..iT%.s&.....J-.....
$6%....A
18:00:58.132788 IP 192.168.100.133.20371 > 192.168.100.48.53770: Flags [F.], seq 41, ack 2, win 1448, options [nop,nop,TS val 101497409 ecr 607528347], length 0
E..43C@.@..z..d...d0O..
.s&..iT&.....l.....
...A$6%.
18:00:58.132832 IP 192.168.100.48.53770 > 192.168.100.133.20371: Flags [.], ack 42, win 502, options [nop,nop,TS val 607528347 ecr 101497409], length 0
E..4N.@.@.....d0..d..
O..iT&.s&.....J-.....
$6%....A
18:00:58.147750 IP 192.168.100.48.53774 > 192.168.100.133.20371: Flags [S], seq 1743390424, win 64240, options [mss 1460,sackOK,TS val 607528362 ecr 0,nop,wscale 7], length 0
E..<9.@.@.....d0..d...O.g...........J5.........
$6%.........
18:00:58.147972 IP 192.168.100.133.20371 > 192.168.100.48.53774: Flags [S.], seq 650383247, ack 1743390425, win 5792, options [mss 1460,sackOK,TS val 101497411 ecr 607528362,nop,wscale 2], length 0
E..<..@.@.....d...d0O...&...g........f.........
...C$6%.....
18:00:58.148037 IP 192.168.100.48.53774 > 192.168.100.133.20371: Flags [.], ack 1, win 502, options [nop,nop,TS val 607528362 ecr 101497411], length 0
E..49.@.@.....d0..d...O.g...&.......J-.....
$6%....C
18:01:01.615442 IP 192.168.100.133.20371 > 192.168.100.48.53774: Flags [P.], seq 1:41, ack 1, win 1448, options [nop,nop,TS val 101497854 ecr 607528362], length 40
E..\..@.@.:...d...d0O...&...g.......+......
....$6%.HHAR2502301#Ba#131945#01321#S0000750#N01
18:01:01.615528 IP 192.168.100.48.53774 > 192.168.100.133.20371: Flags [.], ack 41, win 502, options [nop,nop,TS val 607531830 ecr 101497854], length 0
E..49.@.@.....d0..d...O.g...&.......J-.....
$636....
18:01:01.616270 IP 192.168.100.48.53774 > 192.168.100.133.20371: Flags [F.], seq 1, ack 41, win 502, options [nop,nop,TS val 607531831 ecr 101497854], length 0
E..49.@.@.....d0..d...O.g...&.......J-.....
$637....
18:01:01.616576 IP 192.168.100.133.20371 > 192.168.100.48.53774: Flags [F.], seq 41, ack 2, win 1448, options [nop,nop,TS val 101497855 ecr 607531831], length 0
E..4..@.@.:...d...d0O...&...g.......F......
....$637
18:01:01.616629 IP 192.168.100.48.53774 > 192.168.100.133.20371: Flags [.], ack 42, win 502, options [nop,nop,TS val 607531831 ecr 101497855], length 0
E..49.@.@.....d0..d...O.g...&.......J-.....
$637....
18:01:01.622618 IP 192.168.100.48.53776 > 192.168.100.133.20371: Flags [S], seq 1512341540, win 64240, options [mss 1460,sackOK,TS val 607531837 ecr 0,nop,wscale 7], length 0
E..<.j@.@..J..d0..d...O.Z$.$........J5.........
$63=........
18:01:01.622829 IP 192.168.100.133.20371 > 192.168.100.48.53776: Flags [S.], seq 699328557, ack 1512341541, win 5792, options [mss 1460,sackOK,TS val 101497855 ecr 607531837,nop,wscale 2], length 0
E..<..@.@.....d...d0O...)..-Z$.%...............
....$63=....
18:01:01.622898 IP 192.168.100.48.53776 > 192.168.100.133.20371: Flags [.], ack 1, win 502, options [nop,nop,TS val 607531837 ecr 101497855], length 0
E..4.k@.@..Q..d0..d...O.Z$.%).......J-.....
$63=....
18:01:05.833745 IP 192.168.100.133.20371 > 192.168.100.48.53776: Flags [P.], seq 1:41, ack 1, win 1448, options [nop,nop,TS val 101498394 ecr 607531837], length 40
E..\S.@.@.....d...d0O...)...Z$.%.....;.....
....$63=HHAR2502301#Ba#131945#01321#S0000750#N01
18:01:05.833817 IP 192.168.100.48.53776 > 192.168.100.133.20371: Flags [.], ack 41, win 502, options [nop,nop,TS val 607536048 ecr 101498394], length 0
E..4.l@.@..P..d0..d...O.Z$.%)..V....J-.....
$6C.....
18:01:05.834616 IP 192.168.100.48.53776 > 192.168.100.133.20371: Flags [F.], seq 1, ack 41, win 502, options [nop,nop,TS val 607536049 ecr 101498394], length 0
E..4.m@.@..O..d0..d...O.Z$.%)..V....J-.....
$6C.....
18:01:05.839566 IP 192.168.100.133.20371 > 192.168.100.48.53776: Flags [F.], seq 41, ack 2, win 1448, options [nop,nop,TS val 101498395 ecr 607536049], length 0
E..4S.@.@.....d...d0O...)..VZ$.&.....
.....
....$6C.
18:01:05.839616 IP 192.168.100.48.53776 > 192.168.100.133.20371: Flags [.], ack 42, win 502, options [nop,nop,TS val 607536054 ecr 101498395], length 0
E..4.n@.@..N..d0..d...O.Z$.&)..W....J-.....
$6C.....
18:01:05.842852 IP 192.168.100.48.53778 > 192.168.100.133.20371: Flags [S], seq 145936754, win 64240, options [mss 1460,sackOK,TS val 607536057 ecr 0,nop,wscale 7], length 0
E..<]z@.@..;..d0..d...O....r........J5.........
$6C.........
18:01:05.843068 IP 192.168.100.133.20371 > 192.168.100.48.53778: Flags [S.], seq 762560613, ack 145936755, win 5792, options [mss 1460,sackOK,TS val 101498396 ecr 607536057,nop,wscale 2], length 0
E..<..@.@.....d...d0O...-s.e...s...............
....$6C.....
18:01:05.843136 IP 192.168.100.48.53778 > 192.168.100.133.20371: Flags [.], ack 1, win 502, options [nop,nop,TS val 607536058 ecr 101498396], length 0
E..4]{@.@..B..d0..d...O....s-s.f....J-.....
$6C.....
18:01:10.841613 IP 192.168.100.133.20371 > 192.168.100.48.53778: Flags [.], ack 1, win 1448, options [nop,nop,TS val 101499036 ecr 607536058], length 0
E..4~z@.@.rC..d...d0O...-s.e...s...........
....$6C.
18:01:10.841669 IP 192.168.100.48.53778 > 192.168.100.133.20371: Flags [.], ack 1, win 502, options [nop,nop,TS val 607541056 ecr 101498396], length 0
E..4]|@.@..A..d0..d...O....s-s.f....J-.....
$6W@....
18:01:15.841210 IP 192.168.100.133.20371 > 192.168.100.48.53778: Flags [.], ack 1, win 1448, options [nop,nop,TS val 101499676 ecr 607541056], length 0
E..4~{@.@.rB..d...d0O...-s.e...s...........
....$6W@
18:01:15.841284 IP 192.168.100.48.53778 > 192.168.100.133.20371: Flags [.], ack 1, win 502, options [nop,nop,TS val 607546056 ecr 101498396], length 0
E..4]}@.@..@..d0..d...O....s-s.f....J-.....
$6j.....
18:01:20.840783 IP 192.168.100.133.20371 > 192.168.100.48.53778: Flags [.], ack 1, win 1448, options [nop,nop,TS val 101500316 ecr 607546056], length 0
E..4~|@.@.rA..d...d0O...-s.e...s...........
....$6j.
18:01:20.840836 IP 192.168.100.48.53778 > 192.168.100.133.20371: Flags [.], ack 1, win 502, options [nop,nop,TS val 607551055 ecr 101498396], length 0
E..4]~@.@..?..d0..d...O....s-s.f....J-.....
$6~O....
18:01:25.840351 IP 192.168.100.133.20371 > 192.168.100.48.53778: Flags [.], ack 1, win 1448, options [nop,nop,TS val 101500956 ecr 607551055], length 0
E..4~}@.@.r@..d...d0O...-s.e...s...........
....$6~O
